{
  "$schema": "http://json-schema.org/draft-07/schema#",
  "title": "Tala proposed offline backup v1",
  "description": "Draft documentation contract. Not consumed by the current application. Semantic ownership, uniqueness, questionnaire validation and media checks are additional requirements.",
  "type": "object",
  "additionalProperties": false,
  "properties": {
    "format": {
      "const": "tala-backup"
    },
    "formatVersion": {
      "const": 1
    },
    "exportedAt": {
      "$ref": "#/definitions/timestamp"
    },
    "prototype": {
      "const": true
    },
    "records": {
      "type": "array",
      "items": {
        "$ref": "#/definitions/record"
      },
      "maxItems": 10000
    }
  },
  "required": [
    "format",
    "formatVersion",
    "exportedAt",
    "prototype",
    "records"
  ],
  "definitions": {
    "uuid": {
      "type": "string",
      "pattern": "^[0-9a-f]{8}-[0-9a-f]{4}-[0-9a-f]{4}-[0-9a-f]{4}-[0-9a-f]{12}$"
    },
    "timestamp": {
      "type": "string",
      "format": "date-time",
      "pattern": "Z$"
    },
    "scalar": {
      "type": "object",
      "additionalProperties": false,
      "properties": {
        "kind": {
          "const": "scalar"
        },
        "value": {
          "type": "string"
        }
      },
      "required": [
        "kind",
        "value"
      ]
    },
    "multi": {
      "type": "object",
      "additionalProperties": false,
      "properties": {
        "kind": {
          "const": "multi"
        },
        "value": {
          "type": "array",
          "items": {
            "type": "string"
          },
          "uniqueItems": true,
          "maxItems": 100
        }
      },
      "required": [
        "kind",
        "value"
      ]
    },
    "answer": {
      "type": "object",
      "additionalProperties": false,
      "properties": {
        "section": {
          "type": "string",
          "minLength": 1
        },
        "field": {
          "type": "string",
          "minLength": 1
        },
        "memberId": {
          "anyOf": [
            {
              "$ref": "#/definitions/uuid"
            },
            {
              "type": "null"
            }
          ]
        },
        "answer": {
          "oneOf": [
            {
              "$ref": "#/definitions/scalar"
            },
            {
              "$ref": "#/definitions/multi"
            }
          ]
        }
      },
      "required": [
        "section",
        "field",
        "memberId",
        "answer"
      ]
    },
    "member": {
      "type": "object",
      "additionalProperties": false,
      "properties": {
        "id": {
          "$ref": "#/definitions/uuid"
        },
        "firstName": {
          "type": "string"
        },
        "middleName": {
          "type": "string"
        },
        "lastName": {
          "type": "string"
        },
        "extension": {
          "type": "string"
        },
        "alias": {
          "type": "string"
        },
        "displayName": {
          "type": "string"
        },
        "sortOrder": {
          "type": "integer",
          "minimum": 0
        }
      },
      "required": [
        "id",
        "firstName",
        "middleName",
        "lastName",
        "extension",
        "alias",
        "displayName",
        "sortOrder"
      ]
    },
    "visit": {
      "type": "object",
      "additionalProperties": false,
      "properties": {
        "id": {
          "$ref": "#/definitions/uuid"
        },
        "visitedAt": {
          "$ref": "#/definitions/timestamp"
        },
        "outcome": {
          "enum": [
            "Interview started",
            "Completed visit",
            "Callback",
            "No respondent",
            "Refused"
          ]
        },
        "callbackLocalDateTime": {
          "anyOf": [
            {
              "type": "string",
              "pattern": "^\\d{4}-\\d{2}-\\d{2}T\\d{2}:\\d{2}$"
            },
            {
              "type": "null"
            }
          ]
        },
        "callbackTimeZone": {
          "anyOf": [
            {
              "type": "string",
              "minLength": 1
            },
            {
              "type": "null"
            }
          ]
        },
        "notes": {
          "type": "string"
        }
      },
      "required": [
        "id",
        "visitedAt",
        "outcome",
        "callbackLocalDateTime",
        "callbackTimeZone",
        "notes"
      ]
    },
    "location": {
      "type": "object",
      "additionalProperties": false,
      "properties": {
        "latitude": {
          "type": "number",
          "minimum": -90,
          "maximum": 90
        },
        "longitude": {
          "type": "number",
          "minimum": -180,
          "maximum": 180
        },
        "accuracyMetres": {
          "anyOf": [
            {
              "type": "number",
              "minimum": 0
            },
            {
              "type": "null"
            }
          ]
        },
        "source": {
          "enum": [
            "device",
            "manual"
          ]
        },
        "capturedAt": {
          "$ref": "#/definitions/timestamp"
        },
        "confirmedAt": {
          "$ref": "#/definitions/timestamp"
        },
        "addressAtCapture": {
          "type": "string"
        },
        "notes": {
          "type": "string"
        }
      },
      "required": [
        "latitude",
        "longitude",
        "accuracyMetres",
        "source",
        "capturedAt",
        "confirmedAt",
        "addressAtCapture",
        "notes"
      ]
    },
    "attachment": {
      "type": "object",
      "additionalProperties": false,
      "properties": {
        "id": {
          "$ref": "#/definitions/uuid"
        },
        "memberId": {
          "anyOf": [
            {
              "$ref": "#/definitions/uuid"
            },
            {
              "type": "null"
            }
          ]
        },
        "kind": {
          "enum": [
            "household-photo",
            "member-photo",
            "signature"
          ]
        },
        "mimeType": {
          "enum": [
            "image/jpeg",
            "image/png",
            "image/webp"
          ]
        },
        "byteSize": {
          "type": "integer",
          "minimum": 1,
          "maximum": 5242880
        },
        "sha256": {
          "type": "string",
          "pattern": "^[a-f0-9]{64}$"
        },
        "contentBase64": {
          "type": "string",
          "minLength": 4,
          "maxLength": 6990508,
          "pattern": "^(?:[A-Za-z0-9+/]{4})*(?:[A-Za-z0-9+/]{2}==|[A-Za-z0-9+/]{3}=)?$"
        }
      },
      "required": [
        "id",
        "memberId",
        "kind",
        "mimeType",
        "byteSize",
        "sha256",
        "contentBase64"
      ]
    },
    "interview": {
      "type": "object",
      "additionalProperties": false,
      "properties": {
        "id": {
          "$ref": "#/definitions/uuid"
        },
        "questionnaireVersion": {
          "type": "string",
          "minLength": 1
        },
        "consent": {
          "enum": [
            "Unanswered",
            "Yes",
            "No"
          ]
        },
        "signedName": {
          "anyOf": [
            {
              "type": "string"
            },
            {
              "type": "null"
            }
          ]
        },
        "signatureAttachmentId": {
          "anyOf": [
            {
              "$ref": "#/definitions/uuid"
            },
            {
              "type": "null"
            }
          ]
        },
        "reviewedAt": {
          "anyOf": [
            {
              "$ref": "#/definitions/timestamp"
            },
            {
              "type": "null"
            }
          ]
        },
        "reviewedRevision": {
          "anyOf": [
            {
              "type": "integer",
              "minimum": 0
            },
            {
              "type": "null"
            }
          ]
        },
        "answers": {
          "type": "array",
          "items": {
            "$ref": "#/definitions/answer"
          },
          "maxItems": 100000
        }
      },
      "required": [
        "id",
        "questionnaireVersion",
        "consent",
        "signedName",
        "signatureAttachmentId",
        "reviewedAt",
        "reviewedRevision",
        "answers"
      ]
    },
    "record": {
      "type": "object",
      "additionalProperties": false,
      "properties": {
        "id": {
          "$ref": "#/definitions/uuid"
        },
        "displayCode": {
          "type": "string",
          "minLength": 1
        },
        "headName": {
          "type": "string"
        },
        "address": {
          "type": "string"
        },
        "status": {
          "enum": [
            "NotStarted",
            "InProgress",
            "Callback",
            "Reviewed"
          ]
        },
        "revision": {
          "type": "integer",
          "minimum": 0
        },
        "createdAt": {
          "$ref": "#/definitions/timestamp"
        },
        "updatedAt": {
          "$ref": "#/definitions/timestamp"
        },
        "archivedAt": {
          "anyOf": [
            {
              "$ref": "#/definitions/timestamp"
            },
            {
              "type": "null"
            }
          ]
        },
        "members": {
          "type": "array",
          "items": {
            "$ref": "#/definitions/member"
          },
          "maxItems": 1000
        },
        "interview": {
          "$ref": "#/definitions/interview"
        },
        "visits": {
          "type": "array",
          "items": {
            "$ref": "#/definitions/visit"
          },
          "maxItems": 10000
        },
        "location": {
          "anyOf": [
            {
              "$ref": "#/definitions/location"
            },
            {
              "type": "null"
            }
          ]
        },
        "attachments": {
          "type": "array",
          "items": {
            "$ref": "#/definitions/attachment"
          },
          "maxItems": 1000
        }
      },
      "required": [
        "id",
        "displayCode",
        "headName",
        "address",
        "status",
        "revision",
        "createdAt",
        "updatedAt",
        "archivedAt",
        "members",
        "interview",
        "visits",
        "location",
        "attachments"
      ]
    }
  }
}
